{
  "$schema": "./reviewed-authority-profile.v1.schema.json",
  "schemaVersion": 1,
  "profileId": "threadleaf-trusted-state-fixture-0.1.0",
  "profileRevision": 2,
  "packageIdentity": {
    "pluginId": "threadleaf-trusted-state-fixture",
    "manifestVersion": "0.1.0",
    "distributionTag": "0.1.0",
    "manifestSha256": "6cddabcd0e357820b065eec3f105e0691fa069d90271d534ae67af9005ce8f12",
    "mainSha256": "62f5750ac4fb6903ab49f7c77196a67d43ddd218c568679e1db0c28c72c2f621",
    "stylesSha256": null,
    "packageTreeSha256": "20891faa5f9891ae222c22eb9f40642cc6d287abe45f49ad36102245292e6e5d"
  },
  "packageIdentityDigest": "d1be7469f5df449a6ecf9d4ba35d11e369014cac5a79343fe66ed5d0aaec6583",
  "expectedStaticCapabilities": ["editor-extension"],
  "requiredAuthorities": [
    "network",
    "filesystem",
    "subprocess",
    "host-environment",
    "editor-extension",
    "dynamic-code"
  ],
  "executionProfile": "trusted-node-renderer",
  "allowedPlatforms": ["linux", "darwin", "win32"],
  "authorityDigest": "9b45d7f300f8e80e38b752758087f8b9a28d99b3b07534461a6093349d293a46"
}
