{
  "$schema": "./reviewed-authority-profile.v1.schema.json",
  "schemaVersion": 1,
  "profileId": "threadleaf-trusted-view-fixture-0.1.0",
  "profileRevision": 1,
  "packageIdentity": {
    "pluginId": "threadleaf-trusted-view-fixture",
    "manifestVersion": "0.1.0",
    "distributionTag": "0.1.0",
    "manifestSha256": "9bafbfe3a6ba74a79a7c2de39334233b2d552511996e81873cbefc8d0a31d3de",
    "mainSha256": "266b430c9d0b8932615cdbb42c4f5c5e5606a39ed1a9c68833c03039cc00c003",
    "stylesSha256": null,
    "packageTreeSha256": "7f1cc4335a8690669cb4968486841fa9a872374bc98faad9775e867d6022e681"
  },
  "packageIdentityDigest": "886ae88416d7ce901d98bccc6cd157c515a208f7ee052cbb8fb402bace46d319",
  "expectedStaticCapabilities": ["editor-extension"],
  "requiredAuthorities": [
    "network",
    "filesystem",
    "subprocess",
    "host-environment",
    "editor-extension",
    "dynamic-code"
  ],
  "executionProfile": "trusted-node-renderer",
  "allowedPlatforms": ["linux", "darwin", "win32"],
  "authorityDigest": "c69bd6024c8efe2b7dc18c656badaa54c61e1781298553daa1e9866690fb401a"
}
