{
  "$schema": "./reviewed-authority-profile.v1.schema.json",
  "schemaVersion": 1,
  "profileId": "inspection-safe-0.1.0",
  "profileRevision": 1,
  "packageIdentity": {
    "pluginId": "inspection-safe",
    "manifestVersion": "0.1.0",
    "distributionTag": "0.1.0",
    "manifestSha256": "e41ba4a20494e9aa0ffff7d4d2e91731d7bbe21a429f3f7c2724c63d84a2e0e1",
    "mainSha256": "ce6dba4d929f9b007c3c18863a0925f3cfb1ac0fd877252ee10f3befa7ebc2fc",
    "stylesSha256": "9427ffdd98cc3485b6a0d28a5405bd35e6191e552449367b5adad5ec0b574e54",
    "packageTreeSha256": "fc59639106c9120abd0b7366725bb1187cb99a11bcdefb10e3e1781d4ec214e0"
  },
  "packageIdentityDigest": "d346c598e4a5a56af0b9868c31bd06a6e017db73a90b7954ca1a7fb1523f3401",
  "expectedStaticCapabilities": ["workspace-ui"],
  "requiredAuthorities": [
    "network",
    "filesystem",
    "subprocess",
    "host-environment",
    "workspace-ui",
    "dynamic-code"
  ],
  "executionProfile": "trusted-node-renderer",
  "allowedPlatforms": ["linux", "darwin", "win32"],
  "authorityDigest": "f99ccfe401c5d29168a807a1d70fd40b5286f52f3484e22de24bf6458568b0fc"
}
